user	昔ながらの湯治宿で、お部屋や設備など年季が入っていますが清潔感があり、ひなびた雰囲気を楽しみながら心地よい時間が過ごせました。
user	基本、素泊まりで客室サービスなど一切ありませんが、その分時間に縛られることなく、自分のペースで気ままに過ごせるので、観光の拠点として格安に連泊して自由な旅を楽しむ向きにもおすすめです。
user	朝夕食事付きのプランも用意されていますが、自炊可の素泊まりプランも選べるので、それぞれのニーズに合わせて楽しめるのではないでしょうか。
user	今回、隣の部屋に宿泊していた学生グループは高級肉を持参しての夕食をワイワイと楽しんでいて、コンビニ弁当とカップラーメンで慎ましく食事をしていた私たちにお肉を少しおすそ分けしてくれました。
user	そしてなんと言ってもお風呂がいいです!
user	内風呂、露天風呂とも源泉かけ流しの天然温泉で、やや温めの柔らかい泉質で、しっかり体の芯まで温まります。
user	ついつい長湯したくなりますが、湯あたり注意で徐々に体を慣らしていくといいと思います。
user	あと、これは好みの分かれるところかと思いますが、よく人に慣れた宿猫がいますよ。
